{
  "embodiment_id": "ros2-lyrical-mobile-base-ref",
  "vendor": "RCL Reference",
  "model": "ROS 2 Twist Mobile Base",
  "class": "mobile_base",
  "capabilities": [
    "navigation.planar_velocity",
    "perception.person_tracking",
    "perception.forward_range"
  ],
  "limits": {
    "max_linear_speed_mps": 1.2,
    "max_angular_speed_rps": 1.4
  },
  "sensors": [
    "person_tracker",
    "forward_range"
  ],
  "adapter": {
    "adapter_id": "rcl.ros2.mobile_base",
    "adapter_version": "0.3-dev"
  }
}
